{
  "$schema": "https://neo4j.com/ontology-spec/1.0.0/schema.json",
  "id": "c7d21f58-3a6b-4c9e-b2d8-5e1f7a03c946",
  "version": 1,
  "name": "org",
  "description": "Organisation ontology: people, employment and structure. Exercises the fields the movies example does not.",
  "nodes": {
    "Person": {
      "description": "A human being known to the organisation",
      "properties": {
        "id": { "type": "STRING", "key": true },
        "email": {
          "type": "STRING",
          "unique": true,
          "pattern": "^[^@\\s]+@[^@\\s]+$",
          "description": "Primary work email",
          "extensions": [
            {
              "type": "governance:pii",
              "definition": { "classification": "restricted", "owner": "people-ops" }
            }
          ]
        },
        "name": { "type": "STRING", "mustExist": true }
      }
    },
    "Employee": {
      "labels": {
        "implied": ["Person"]
      },
      "description": "A person employed by the organisation",
      "aliases": ["Staff member"],
      "properties": {
        "employee_id": { "type": "STRING", "key": true },
        "skills": {
          "type": { "kind": "list", "items": "STRING" },
          "aliases": ["competencies"]
        },
        "face_embedding": {
          "type": { "kind": "vector", "items": "FLOAT" },
          "description": "Badge-photo embedding; dimension unconstrained at authoring time"
        }
      }
    },
    "Contractor": {
      "labels": {
        "implied": ["Person"]
      },
      "properties": {
        "contract_id": { "type": "STRING", "key": true }
      }
    },
    "Department": {
      "properties": {
        "name": { "type": "STRING", "mustExist": true },
        "region": { "type": "STRING", "enum": ["EMEA", "AMER", "APAC"] },
        "cost_center": { "type": "INTEGER" }
      },
      "constraints": [
        { "kind": "key", "properties": ["name", "region"] }
      ],
      "extensions": [
        {
          "type": "ui:display",
          "definition": { "color": "#4c9aff", "icon": "building" }
        }
      ]
    }
  },
  "relationships": {
    "WORKS_IN": {
      "from": { "node": "Employee" },
      "to": { "node": "Department" },
      "cardinality_type": "MANY_TO_ONE",
      "description": "Current organisational home",
      "properties": {
        "since": { "type": "DATE" },
        "fte": { "type": "FLOAT", "description": "Fraction of full-time employment" }
      },
      "extensions": [
        {
          "type": "tool",
          "name": "colleaguesOf",
          "kind": "canonicalQuery",
          "definition": {
            "description": "Colleagues of an employee across their departments",
            "cypher": "MATCH (e:Employee)-[:WORKS_IN]->(d:Department)<-[:WORKS_IN]-(c:Employee) WHERE e.employee_id = $id RETURN c"
          }
        }
      ]
    },
    "MANAGES": {
      "from": { "node": "Employee" },
      "to": { "node": "Department" },
      "cardinality_type": "ONE_TO_ONE",
      "constraints": [
        { "kind": "unique", "properties": ["since", "note"] }
      ],
      "properties": {
        "since": { "type": "DATE", "mustExist": true },
        "note": { "type": "STRING" }
      }
    },
    "REPORTS_TO": {
      "from": { "node": "Employee" },
      "to": { "node": "Employee" },
      "cardinality_type": "MANY_TO_ONE"
    },
    "SUPPORTS": {
      "from": { "node": "Department" },
      "to": { "node": "Department" },
      "cardinality_type": "MANY_TO_MANY",
      "description": "Cross-department service relationships"
    },
    "STAFFS": {
      "from": { "node": "Department" },
      "to": { "node": "Contractor" },
      "cardinality_type": "ONE_TO_MANY",
      "properties": {
        "po_number": { "type": "STRING", "pattern": "^PO-[0-9]{6}$" }
      }
    }
  },
  "extensions": [
    {
      "type": "neo4j-importer:table",
      "name": "employees",
      "definition": {
        "source": "hr/workday",
        "columns": { "employee_id": { "type": "varchar" }, "full_name": { "type": "varchar" } }
      }
    },
    {
      "type": "governance:retention",
      "$schema": "https://example.com/ontology-extensions/governance-retention/0.1.0/schema.json",
      "definition": { "review_after_days": 365 }
    }
  ]
}
